{
  "schemaId": "https://schemas.repo-template.dev/local-ci-v3/post-publication-readback-receipt.schema.json",
  "schemaVersion": "3.0.0",
  "contractId": "repo-template/local-ci-v3-post-publication-readback",
  "receiptKind": "repo-template/local-ci-v3-readback-receipt/v1",
  "receiptId": "receipt-issue-341-mu15pl0x",
  "publicationState": "published",
  "programmeEpic": "https://github.com/spencer-shadley/repo-template/issues/102",
  "issue": "https://github.com/spencer-shadley/repo-template/issues/341",
  "producerFreezeIssue": "https://github.com/spencer-shadley/repo-template/issues/340",
  "producerCandidateReceiptId": "receipt-issue-340-rt340repair1",
  "producerCandidateReceiptDigest": "e7021ea10b694f37b03275a7cbd9c9ea6ca0d3b72f1806c2e3ed50814897bb5d",
  "candidate": {
    "repository": "spencer-shadley/repo-template",
    "origin": "https://github.com/spencer-shadley/repo-template.git",
    "semver": "3.2.0",
    "tag": "v3.2.0",
    "commit": "88591ee869bb109ef481171aa817d1ed204a970e",
    "tree": "995ea497114b2eba0b86cc3adb3666306829e0fb"
  },
  "lineage": {
    "contractId": "repo-template/local-ci-v3",
    "schemaVersion": "3.0.0",
    "outcomeContractId": "repo-template/local-ci-outcome-v1",
    "outcomeSchemaVersion": "1.0.0",
    "proofOfDetectionRequired": true,
    "establishedBy": "https://github.com/spencer-shadley/repo-template/issues/131",
    "establishedPr": "https://github.com/spencer-shadley/repo-template/pull/132",
    "decisionRecord": "docs/adr/0009-local-ci-contract-v3-proof-of-detection.md"
  },
  "canaryReceipts": {
    "modelGateway": {
      "issue": "https://github.com/spencer-shadley/model-gateway/issues/991",
      "receiptId": "receipt-issue-991-mu14rxy2",
      "receiptKind": "model-gateway/local-ci-v3-canary-receipt/v1",
      "receiptDigest": "65d52a0185353f8646943aa2e8cca6e7b2c04dc14a3bc7e3ec00be6788445f7b",
      "receiptUrl": "https://github.com/spencer-shadley/model-gateway/issues/991#issuecomment-5677659016",
      "consumerRepository": "spencer-shadley/model-gateway",
      "consumerRole": "first dissimilar canary",
      "targetLineage": "runtime/checks/effects",
      "verifiedOutcomes": [
        "pass",
        "fail",
        "skipped",
        "could-not-execute"
      ],
      "noUnclaimedEffects": true,
      "candidateDigestMatches": true
    },
    "repoFactory": {
      "issue": "https://github.com/spencer-shadley/repo-factory/issues/187",
      "receiptId": "receipt-issue-187-mu14zjfz",
      "receiptKind": "repo-factory/local-ci-v3-canary-receipt/v1",
      "receiptDigest": "0aa881725aea8258cb1879b4af83fb8655df364e4efc3ca7f0c8dc21ef0dab72",
      "receiptUrl": "https://github.com/spencer-shadley/repo-factory/issues/187#issuecomment-5722794813",
      "consumerRepository": "spencer-shadley/repo-factory",
      "consumerRole": "second dissimilar canary",
      "targetLineage": "entrypoint/gates/flags",
      "verifiedOutcomes": [
        "pass",
        "fail",
        "skipped",
        "could-not-execute"
      ],
      "noUnclaimedEffects": true,
      "candidateDigestMatches": true
    }
  },
  "publishedReleaseReceipt": {
    "schemaId": "https://schemas.repo-template.dev/adoption-shell-v2/template-release-receipt.schema.json",
    "schemaVersion": "2.0.0",
    "schemaDigest": "56640de35655e7eb92953cbb27a2c247f6dbf775584671d6cd052458791b7da7",
    "contractId": "repo-template/adoption-shell-v2",
    "receiptKind": "repo-template/release-receipt/v1",
    "publicationState": "published",
    "releaseId": "spencer-shadley/repo-template@3.2.0",
    "receiptDigestAlgorithm": "sha256-rfc8785-v1",
    "producer": {
      "repository": "spencer-shadley/repo-template",
      "origin": "https://github.com/spencer-shadley/repo-template.git",
      "semver": "3.2.0",
      "tag": "v3.2.0",
      "commit": "88591ee869bb109ef481171aa817d1ed204a970e",
      "tree": "995ea497114b2eba0b86cc3adb3666306829e0fb"
    },
    "receiptTransport": {
      "kind": "annotated-git-tag-message/v1",
      "tagName": "v3.2.0",
      "targetObjectType": "commit",
      "bodyEncoding": "utf-8",
      "bodyCanonicalization": "rfc8785"
    },
    "payloadSet": {
      "manifestPath": "release/release-payload-set.json",
      "schemaId": "https://schemas.repo-template.dev/adoption-shell-v2/release-payload-set.schema.json",
      "schemaVersion": "2.0.0",
      "schemaDigest": "2e45fc30726def40628985347b729586ab8944c2387c1325cd2264740280733f",
      "manifestDigest": "bd900c3edc54790b60b5160681c1fe0c47ef4e82be0ea266b7ae75c9299f8acd",
      "payloadDigestAlgorithm": "sha256-framed-path-kind-mode-content-v1",
      "payloadDigest": "2c761553dab52c2fc5f2ce8e7d8a16110af041d7747d7b1840e9074bff7a4307",
      "entryCount": 99
    },
    "capabilityBundles": [
      {
        "id": "repo-template/local-ci-contract-v2",
        "version": "2.0.0",
        "digest": "12e6604b74413263039d55b4705e4d0e1cc3b854d7aead900d91cd9cef093e60"
      },
      {
        "id": "repo-template/local-ci-contract-v3",
        "version": "3.0.0",
        "digest": "88b0d1f44eac757962de977f4c58682f546f31d2065f113ab001e50cf53b343d"
      },
      {
        "id": "repo-template/proof-of-detection",
        "version": "1.0.0",
        "digest": "69d8f6c55dbee595c2f4907085d478d2531091b37d726ef4670462c2642ee95f"
      },
      {
        "id": "repo-template/quality-lint",
        "version": "1.1.0",
        "digest": "6acbd065f751cd08e13d030c02a710f29f0ad7aa4daf85e5bed4e82c0ada5277"
      },
      {
        "id": "repo-template/user-surface-lint",
        "version": "2.6.0",
        "digest": "28c17d3287f732bfcf1bab72735f8185374f091113b83d92757a0c4680413cfe"
      }
    ],
    "materializer": {
      "contractId": "repo-template/adoption-shell-v2",
      "contractVersion": "2.0.0",
      "artifactManifestPath": "artifacts/adoption-shell-v2/artifact-manifest.json",
      "artifactManifestSchemaId": "https://schemas.repo-template.dev/adoption-shell-v2/artifact-manifest.schema.json",
      "artifactManifestSchemaVersion": "2.0.0",
      "artifactManifestSchemaDigest": "b805467065d2538dc3bf21d6249eda17dd4a342a27252e12a8dea7d458256b95",
      "artifactManifestDigest": "5e87485f663042c9e9943f0a5a41c3d87de1e5c6501bb37eeeec3935f0be3838",
      "artifactDigest": "778c415b92d581866ab351c4198a28f7339eb3cfe4ee3f44373de582f2a8611a",
      "entrypoint": "index.js",
      "validatorExport": "validateMaterializerInputV2",
      "runtimeCompatibility": ">=24.16.0 <25",
      "compatibleReleaseReceiptKind": "repo-template/release-receipt/v1"
    },
    "releaseEvidence": {
      "review": {
        "subject": "producer-commit",
        "url": "https://github.com/spencer-shadley/repo-template/pull/369#pullrequestreview-5206920572",
        "result": "approved"
      },
      "canaryReceipts": {
        "model-gateway": {
          "url": "https://github.com/spencer-shadley/model-gateway/issues/991#issuecomment-5677659016",
          "receiptSha256": "65d52a0185353f8646943aa2e8cca6e7b2c04dc14a3bc7e3ec00be6788445f7b"
        },
        "repo-factory": {
          "url": "https://github.com/spencer-shadley/repo-factory/issues/187#issuecomment-5722794813",
          "receiptSha256": "0aa881725aea8258cb1879b4af83fb8655df364e4efc3ca7f0c8dc21ef0dab72"
        }
      },
      "checks": {
        "repo-template-verify": {
          "command": "corepack pnpm verify",
          "result": "passed"
        },
        "proof-of-detection-self-test": {
          "command": "node scripts/proof-of-detection/run-meta-gate.ts --self-test",
          "result": "passed"
        },
        "local-ci-v3-contract-unit": {
          "command": "node --test packages/adoption-shell/test/local-ci-contract-v3.test.ts",
          "result": "passed"
        },
        "local-ci-outcome-v1-unit": {
          "command": "node --test packages/adoption-shell/test/local-ci-outcome-v1.test.ts",
          "result": "passed"
        },
        "release-payload-check": {
          "command": "node tools/release-payload.ts check",
          "result": "passed"
        },
        "artifact-build-verify": {
          "command": "node tools/artifact-build.ts verify",
          "result": "passed"
        }
      },
      "publicationReadback": {
        "kind": "producer-tag-ref/v1"
      },
      "rollback": {
        "disposition": "immutable-correct-forward",
        "supersession": "new-semver-only"
      }
    },
    "migrationRefs": [],
    "receiptDigest": "2b7a030320e24445cec7c05b8af32bfb109d0efb1cf7fee1b5c49d2ea83f7105"
  },
  "canonicalDigests": {
    "contracts/local-ci/v3/local-ci-contract-v3.schema.json": "8bae75ca0d7911f42a78ef05efcc02b4e765b46c1f1b258ad7ed59e4d52691b4",
    "contracts/local-ci/v3/local-ci-outcome-v1.schema.json": "0ae86bc068fbd4e1cc2ff58409d3909204573f0ac0b09cdbc7dab974bb4ea429",
    "packages/adoption-shell/src/local-ci-contract-v3.ts": "7cd5722303bcf01fae618bcd76225a9f39289cd74901ebddc04a60d303378575",
    "packages/adoption-shell/src/local-ci-outcome-v1.ts": "07f87d011d3b44f6243dd7a535b1ee99386c0741f4bfcfb79395f1573b69b760",
    "artifacts/adoption-shell-v2/local-ci-contract-v3.js": "21ed068020eaa31e5b8a82d57caedb998661452ead347f8afa2fcb120f302d51",
    "artifacts/adoption-shell-v2/local-ci-contract-v3.d.ts": "ac16dfa06dbfc2a1b06c752c6b362249411efb8bad4e69af251c4925796fb171",
    "artifacts/adoption-shell-v2/local-ci-outcome-v1.js": "43d85d2ef36292f7527680f25ad7e66aed7c22d55b9afd42d6355bdf4a9deca8",
    "artifacts/adoption-shell-v2/local-ci-outcome-v1.d.ts": "1fdfa9789cea1f8f705b7460324fe225f5ff16b6dc4594b5fcc052ea4793c52b",
    "contracts/local-ci/v3/fixtures/invalid-detection-proof-conflict.json": "f6da61353b1613aae16c214f87997a671ee52b39d237226605ce1afb03f9415e",
    "contracts/local-ci/v3/fixtures/invalid-detection-proof-empty-exempt.json": "8b0bdb400687bc192ac20186884121ef9fcb0e5a1ae1029455c4e207487ed6f7",